{
 "schema_version": "handoff-work-packages/1",
 "engagement_id": "fx-hv1-02",
 "revision": 1,
 "based_on": [
  {
   "ref": "_design/functional-contracts.json"
  }
 ],
 "retired_ids": [],
 "items": [
  {
   "id": "WP-0001",
   "scope_id": "SCOPE-0001",
   "purpose": "Submissão idempotente",
   "realizes": [
    "FC-0001",
    "_blueprint/ux-blueprint_v01.yaml#architecture/compositions[component=submissao-idempotente]"
   ],
   "proves": [],
   "depends_on": [],
   "acceptance": [
    {
     "fc": "FC-0001",
     "condition": "exemplo negativo do FC-0001"
    }
   ],
   "skills": [
    "plataforma"
   ],
   "definition_of_done": "exemplos do FC-0001 a passar"
  },
  {
   "id": "WP-0002",
   "scope_id": "SCOPE-0001",
   "purpose": "Aprovação com segregação no servidor",
   "realizes": [
    "FC-0003",
    "C-004"
   ],
   "proves": [],
   "depends_on": [
    "WP-0001"
   ],
   "acceptance": [
    {
     "fc": "FC-0003",
     "condition": "exemplo negativo do FC-0003 pela interface e pela API"
    }
   ],
   "skills": [
    "plataforma"
   ],
   "definition_of_done": "exemplos do FC-0003 a passar"
  }
 ]
}
